{
  "fixture_contract_version": "1.0",
  "fixture_id": "sysmon-event1-ordinary-notepad-001",
  "source_format": "sysmon_eventlog_json",
  "system": {
    "provider_name": "Microsoft-Windows-Sysmon",
    "provider_guid": "{44444444-4444-4444-4444-444444444444}",
    "provider_event_id": 1,
    "event_version": 5,
    "event_level": 4,
    "event_task": 1,
    "event_opcode": 0,
    "event_keywords": "0x8000000000000000",
    "system_time": "2026-01-15T01:04:03.123Z",
    "event_record_id": 41003,
    "channel": "Microsoft-Windows-Sysmon/Operational",
    "computer": "WIN-FIXTURE01"
  },
  "event_data": {
    "RuleName": "-",
    "UtcTime": "2026-01-15 01:04:03.123",
    "ProcessGuid": "{33333333-3333-3333-3333-333333333331}",
    "ProcessId": "4300",
    "Image": "C:\\Windows\\System32\\notepad.exe",
    "FileVersion": "10.0.0.0",
    "Description": "Synthetic Notepad fixture",
    "Product": "Synthetic Windows fixture",
    "Company": "Example Lab",
    "OriginalFileName": "NOTEPAD.EXE",
    "CommandLine": "notepad.exe C:\\LabFixture\\readme.txt",
    "CurrentDirectory": "C:\\LabFixture\\",
    "User": "LAB\\fixture-user",
    "LogonGuid": "{33333333-3333-3333-3333-333333333333}",
    "LogonId": "0x123ABC",
    "TerminalSessionId": "1",
    "IntegrityLevel": "Medium",
    "Hashes": "SHA256=CCCCCCCCCCCCCCCCCCCCCCCCCCCCCCCCCCCCCCCCCCCCCCCCCCCCCCCCCCCCCCCC",
    "ParentProcessGuid": "{33333333-3333-3333-3333-333333333332}",
    "ParentProcessId": "3900",
    "ParentImage": "C:\\Windows\\explorer.exe",
    "ParentCommandLine": "explorer.exe",
    "ParentUser": "LAB\\fixture-user"
  }
}
