{
  "fixture_contract_version": "1.0",
  "fixture_id": "sysmon-event1-encoded-flag-001",
  "source_format": "sysmon_eventlog_json",
  "system": {
    "provider_name": "Microsoft-Windows-Sysmon",
    "provider_guid": "{44444444-4444-4444-4444-444444444444}",
    "provider_event_id": 1,
    "event_version": 5,
    "event_level": 4,
    "event_task": 1,
    "event_opcode": 0,
    "event_keywords": "0x8000000000000000",
    "system_time": "2026-01-15T01:03:03.123Z",
    "event_record_id": 41002,
    "channel": "Microsoft-Windows-Sysmon/Operational",
    "computer": "WIN-FIXTURE01"
  },
  "event_data": {
    "RuleName": "-",
    "UtcTime": "2026-01-15 01:03:03.123",
    "ProcessGuid": "{22222222-2222-2222-2222-222222222221}",
    "ProcessId": "4200",
    "Image": "C:\\Windows\\System32\\WindowsPowerShell\\v1.0\\powershell.exe",
    "FileVersion": "10.0.0.0",
    "Description": "Synthetic PowerShell encoded-flag fixture",
    "Product": "Synthetic Windows fixture",
    "Company": "Example Lab",
    "OriginalFileName": "PowerShell.EXE",
    "CommandLine": "powershell.exe -NoProfile -EncodedCommand SAFE_PLACEHOLDER",
    "CurrentDirectory": "C:\\LabFixture\\",
    "User": "LAB\\fixture-user",
    "LogonGuid": "{22222222-2222-2222-2222-222222222223}",
    "LogonId": "0x123ABC",
    "TerminalSessionId": "1",
    "IntegrityLevel": "Medium",
    "Hashes": "SHA256=BBBBBBBBBBBBBBBBBBBBBBBBBBBBBBBBBBBBBBBBBBBBBBBBBBBBBBBBBBBBBBBB",
    "ParentProcessGuid": "{22222222-2222-2222-2222-222222222222}",
    "ParentProcessId": "4000",
    "ParentImage": "C:\\Windows\\System32\\cmd.exe",
    "ParentCommandLine": "cmd.exe",
    "ParentUser": "LAB\\fixture-user"
  }
}
